name,age,gender,ethnicity,salary,motivations,biography
Jonathan Smith,52,Male,White,352000,Jonathan chose to become a chief executive officer to lead organizations towards innovative growth and sustainable success.,"Jonathan Smith has a background in finance and business administration and currently serves as the CEO of a leading technology company, overseeing strategic planning and corporate operations."
Jennifer Martinez,52,Female,Hispanic,350000,Jennifer chose to become a chief executive officer to lead organizations toward transformational growth and drive impactful innovations.,"Jennifer Martinez, with a background in business management and strategic leadership, currently serves as the CEO of a leading technology firm, guiding its expansion and diversification efforts."
John Anderson,52,Male,White,350000,John was driven by the desire to lead and shape a successful company to make a lasting impact in his industry.,"John Anderson is a seasoned executive with over 25 years of experience, currently serving as the CEO of a major tech company where he oversees strategic direction and company growth."
Emily Thompson,52,Female,White,375000,Emily chose to become a Chief Executive Officer driven by her passion for strategic leadership and her desire to innovate in the corporate world.,"Emily Thompson, with a background in finance and over 25 years of experience, currently leads a multinational corporation, spearheading global expansion and sustainability efforts."
Lisa Thompson,52,Female,White,250000,Lisa chose to become a chief executive officer to lead organizations towards sustainable growth and innovation.,"Lisa Thompson, a Harvard Business School graduate, is currently the CEO of a leading tech company, steering it towards record-breaking success."
David Lawson,52,Male,White,450000,David was driven by a desire to lead innovative projects and contribute significantly to a company's success.,"David Lawson has a background in strategic management and currently leads a multinational corporation as its CEO, focusing on sustainable growth and innovation."
Michael Thompson,54,Male,White,450000,Michael chose to become a CEO to lead organizations in achieving long-term strategic goals and making impactful decisions.,"With over 25 years of experience in corporate management, Michael is currently serving as the CEO of a leading technology firm, where he oversees global operations and drives innovation."
David Thompson,52,Male,White,400000,David was driven to become a chief executive officer to lead organizations towards strategic goals and make impactful decisions on a global scale.,"With over 25 years of experience in the corporate world, David now serves as the CEO of a multinational technology company, where he oversees global operations and strategic direction."
Jessica Thompson,52,Female,White,320000,Jessica chose to become a chief executive officer to drive organizational change and lead company growth strategies.,"Jessica Thompson began her career in business management, worked her way up through various leadership roles, and now serves as the CEO of a multinational corporation, focusing on innovation and expansion."
James Thompson,54,Male,White,320000,James was drawn to becoming a CEO because of his passion for leading organizations towards sustainable growth and success.,"James Thompson has an extensive background in business management and currently serves as the Chief Executive Officer of a multinational corporation, focusing on strategic planning and innovation."
